{
  "schemaVersion": "1.0.0",
  "cardId": "CX-508",
  "worldId": "lingmai-ember-red-mist",
  "referenceCatalog": "content/reference-library/catalog.json",
  "generationPolicy": {
    "stillImagesOnly": true,
    "geminiOrVeoUsed": false,
    "overwriteExistingAssets": false,
    "realPeopleIdentityReuseAllowed": false,
    "adoptionRequiresHumanReview": true,
    "allowUnverifiedPersonalReferences": true
  },
  "requiredIdentityAnchorIds": [
    "identity.shen_yan.v1",
    "identity.chu_mingqi.v1",
    "identity.shi_jun.v1",
    "identity.celadon_scout.v1",
    "identity.cavern_ally.v1",
    "identity.formation_spirit.v1",
    "creature.ink_dragon.v1"
  ],
  "requiredFirstFrameIds": [
    "firstframe.node.camp.v3",
    "firstframe.node.alliance.v3",
    "firstframe.node.corpse_signs.v3",
    "firstframe.node.rescue.v3",
    "firstframe.shijun.negotiation.v3",
    "firstframe.node.formation.v3",
    "firstframe.node.combat_one.v3",
    "firstframe.node.combat_two.v3",
    "firstframe.node.aftermath.v3",
    "firstframe.node.ending.v3",
    "firstframe.dialogue.scout_mist.v3",
    "firstframe.dialogue.scout_alliance.v3",
    "firstframe.dialogue.scout_rescue.v3",
    "firstframe.dialogue.formation_spirit.v3",
    "firstframe.dialogue.cavern_ally.v3"
  ],
  "candidates": [
    {
      "assetId": "identity.shen_yan.v1",
      "assetKind": "identity_anchor",
      "generationMode": "codex_builtin_imagegen",
      "adoptionStatus": "needs_review",
      "adopted": false,
      "shipInBuild": false,
      "outputPath": "content/visual-candidates/cx508/identity-anchors/identity_shen_yan_v1.png",
      "referenceInputs": [
        {
          "assetId": "ref-architecture-001-b5834f783d",
          "assetSha256": "6140e365408b92811519f65b653231149c9bd1dc7092615dd6d9d6bd3493c02c",
          "role": "structure"
        },
        {
          "assetId": "ref-artifacts-001-c3a4a9fb55",
          "assetSha256": "38b058ddd81c4dfbed212a116bcb2d4e2ff44ef773735a63d43729cdd42ed9d0",
          "role": "material"
        },
        {
          "assetId": "ref-landscape-001-74d99e0571",
          "assetSha256": "3c45b92acb0c8f522c2cffef37a119ceedbe3060993d6e8961aa36f336e73fb9",
          "role": "lighting"
        },
        {
          "assetId": "ref-people-002-97a702ff69",
          "assetSha256": "9f6dd98f0cd2c0f6150e1a8b6a5427a0a4ec1b2cc68125ee9a4f50c558f5f879",
          "role": "pose"
        },
        {
          "assetId": "ref-costumes-textiles-022-wikime-8bf6f0ffbe33",
          "assetSha256": "899ca152b6e82b2cd1b4bcf3066805c565385cbcab599b0d73381cd50e53acba",
          "role": "surface_detail"
        }
      ],
      "prompt": "USE CASE: historical-scene. Create a photoreal live-action, premium historical cultivation-fantasy film still in an original world. Use monumental physically buildable ivory jade, warm limestone, vermilion timber, aged gilded bronze and celadon tile. Use bright motivated daylight, cool detailed shadows, shared environment bounce, contact shadows, natural skin and real cloth weight. Preserve stable identity and exact prop/person counts. No text, pseudo-writing, watermark, actor likeness, copied landmark, Qing clothing, modern objects, pasted-on figures, malformed hands, duplicate props, floating objects, stretched anatomy, global darkness or excessive bloom. Shen Yan is one original East Asian man in his mid-twenties, deep-teal travel robe, empty hands and exactly one closed dark-gold flying-blade case. Full-body three-quarter stance on a wet sanctuary terrace; grounded boots and restrained alert expression.",
      "avoidItems": [
        "no_text",
        "no_watermark",
        "no_actor_likeness",
        "no_copied_landmark",
        "no_qing_clothing",
        "no_nonuniform_stretch"
      ],
      "continuityLocks": [
        "stable_identity",
        "stable_prop_count",
        "grounded_contact",
        "shared_environment_light"
      ],
      "postProcess": {
        "mode": "aspect_crop",
        "sourceWidth": 1672,
        "sourceHeight": 941,
        "outputWidth": 1664,
        "outputHeight": 936,
        "cropStrategy": "center",
        "focusDescription": "Remove four horizontal pixels per side and two/three vertical edge pixels; preserve central subject without resampling."
      },
      "artifact": {
        "mediaType": "image/png",
        "byteLength": 3693281,
        "sha256": "1a0973205fac132f1f5d3c658f8921200d5ce4ca7575182a2c85ab80eb166e50",
        "width": 1664,
        "height": 936
      },
      "reviewChecks": {
        "skinAndFabric": "pending",
        "weightBearing": "pending",
        "contactShadows": "pending",
        "sharedLighting": "pending",
        "perspectiveScale": "pending",
        "handsAndProps": "pending",
        "noTextOrWatermark": "pending",
        "noLandmarkReplication": "pending",
        "noActorLikeness": "pending"
      }
    },
    {
      "assetId": "identity.chu_mingqi.v1",
      "assetKind": "identity_anchor",
      "generationMode": "codex_builtin_imagegen",
      "adoptionStatus": "needs_review",
      "adopted": false,
      "shipInBuild": false,
      "outputPath": "content/visual-candidates/cx508/identity-anchors/identity_chu_mingqi_v1.png",
      "referenceInputs": [
        {
          "assetId": "ref-architecture-001-b5834f783d",
          "assetSha256": "6140e365408b92811519f65b653231149c9bd1dc7092615dd6d9d6bd3493c02c",
          "role": "structure"
        },
        {
          "assetId": "ref-artifacts-002-6a1870a67c",
          "assetSha256": "243a377edd25896d344c7e666e7dad16f8b26eb881b5175ded017726ea62bd70",
          "role": "material"
        },
        {
          "assetId": "ref-landscape-001-74d99e0571",
          "assetSha256": "3c45b92acb0c8f522c2cffef37a119ceedbe3060993d6e8961aa36f336e73fb9",
          "role": "lighting"
        },
        {
          "assetId": "ref-people-003-4763a77d34",
          "assetSha256": "e47c769d1242922e7d2d795b0b2bd5c597422653bcb930bd3281bd07861d618f",
          "role": "pose"
        },
        {
          "assetId": "ref-costumes-textiles-022-wikime-8bf6f0ffbe33",
          "assetSha256": "899ca152b6e82b2cd1b4bcf3066805c565385cbcab599b0d73381cd50e53acba",
          "role": "surface_detail"
        }
      ],
      "prompt": "USE CASE: historical-scene. Create a photoreal live-action, premium historical cultivation-fantasy film still in an original world. Use monumental physically buildable ivory jade, warm limestone, vermilion timber, aged gilded bronze and celadon tile. Use bright motivated daylight, cool detailed shadows, shared environment bounce, contact shadows, natural skin and real cloth weight. Preserve stable identity and exact prop/person counts. No text, pseudo-writing, watermark, actor likeness, copied landmark, Qing clothing, modern objects, pasted-on figures, malformed hands, duplicate props, floating objects, stretched anatomy, global darkness or excessive bloom. Chu Mingqi is one original East Asian woman in her mid-twenties, moon-white and dark-vermilion battle robes, empty hands, one small silver hair crown and exactly one rigid circular moon-ring attached at the waist; never a bag or handheld loop.",
      "avoidItems": [
        "no_text",
        "no_watermark",
        "no_actor_likeness",
        "no_copied_landmark",
        "no_qing_clothing",
        "no_nonuniform_stretch"
      ],
      "continuityLocks": [
        "stable_identity",
        "stable_prop_count",
        "grounded_contact",
        "shared_environment_light"
      ],
      "postProcess": {
        "mode": "aspect_crop",
        "sourceWidth": 1672,
        "sourceHeight": 941,
        "outputWidth": 1664,
        "outputHeight": 936,
        "cropStrategy": "center",
        "focusDescription": "Remove four horizontal pixels per side and two/three vertical edge pixels; preserve central subject without resampling."
      },
      "artifact": {
        "mediaType": "image/png",
        "byteLength": 3820585,
        "sha256": "7b2d838f4883e0bf32e8c5f50c3317eecf16377ae3db98706d09c6f8506ea079",
        "width": 1664,
        "height": 936
      },
      "reviewChecks": {
        "skinAndFabric": "pending",
        "weightBearing": "pending",
        "contactShadows": "pending",
        "sharedLighting": "pending",
        "perspectiveScale": "pending",
        "handsAndProps": "pending",
        "noTextOrWatermark": "pending",
        "noLandmarkReplication": "pending",
        "noActorLikeness": "pending"
      }
    },
    {
      "assetId": "identity.shi_jun.v1",
      "assetKind": "identity_anchor",
      "generationMode": "codex_builtin_imagegen",
      "adoptionStatus": "needs_review",
      "adopted": false,
      "shipInBuild": false,
      "outputPath": "content/visual-candidates/cx508/identity-anchors/identity_shi_jun_v2.png",
      "referenceInputs": [
        {
          "assetId": "ref-architecture-004-5f8ba81573",
          "assetSha256": "73f7d675a4e295e070358e9817f8b14ce45ebcf67c418d57815155a90cfe25e4",
          "role": "structure"
        },
        {
          "assetId": "ref-artifacts-001-c3a4a9fb55",
          "assetSha256": "38b058ddd81c4dfbed212a116bcb2d4e2ff44ef773735a63d43729cdd42ed9d0",
          "role": "material"
        },
        {
          "assetId": "ref-landscape-001-74d99e0571",
          "assetSha256": "3c45b92acb0c8f522c2cffef37a119ceedbe3060993d6e8961aa36f336e73fb9",
          "role": "lighting"
        },
        {
          "assetId": "ref-people-002-97a702ff69",
          "assetSha256": "9f6dd98f0cd2c0f6150e1a8b6a5427a0a4ec1b2cc68125ee9a4f50c558f5f879",
          "role": "pose"
        },
        {
          "assetId": "ref-costumes-textiles-022-wikime-8bf6f0ffbe33",
          "assetSha256": "899ca152b6e82b2cd1b4bcf3066805c565385cbcab599b0d73381cd50e53acba",
          "role": "surface_detail"
        }
      ],